{
  "$schema": "../schemas/v2/upgrades.schema.json",
  "entity_id": "upgrades_duelist",
  "name": "Duelist Upgrades",
  "game_version": "0.1.1",
  "last_modified": "2026-02-26",
  "archetype": "Duelist",
  "level_cap": 25,
  "population_scaling": [
    { "level": 1, "population_cap": 10 }
  ],
  "incantation_upgrades": []
}
